{
  "schemaVersion": 1,
  "canvas": [
    1536,
    1024
  ],
  "source": "Web/wwwroot/assets/broadcast-kit/combat-concept.png",
  "regions": [
    {
      "id": "objective-frame",
      "category": "ui-frame",
      "label": "Objective gold perimeter",
      "priority": 100,
      "shape": {
        "type": "polygon",
        "points": [
          [
            20,
            32
          ],
          [
            31,
            28
          ],
          [
            280,
            28
          ],
          [
            294,
            34
          ],
          [
            294,
            75
          ],
          [
            282,
            82
          ],
          [
            31,
            81
          ],
          [
            20,
            74
          ]
        ]
      }
    },
    {
      "id": "objective-body",
      "category": "ui-panel",
      "label": "Objective parchment face",
      "priority": 110,
      "shape": {
        "type": "rect",
        "bounds": [
          31,
          35,
          252,
          39
        ]
      },
      "parentId": "objective-frame"
    },
    {
      "id": "objective-lantern",
      "category": "ui-icon",
      "label": "Lantern illustration and hanging loop",
      "priority": 130,
      "shape": {
        "type": "mask",
        "src": "masks/ui/objective-lantern.png",
        "bounds": [
          41,
          15,
          44,
          66
        ]
      },
      "parentId": "objective-frame"
    },
    {
      "id": "objective-label",
      "category": "text",
      "label": "OPEN THE EXIT",
      "priority": 150,
      "shape": {
        "type": "mask",
        "src": "masks/ui/objective-label.png",
        "bounds": [
          104,
          42,
          170,
          25
        ]
      },
      "text": {
        "value": "OPEN THE EXIT",
        "confidence": 1.0,
        "fontApproximation": "Condensed serif display; original font unavailable in flattened source",
        "editableOriginal": false
      },
      "tags": [
        "source-visible-glyphs",
        "baked-antialiasing"
      ],
      "note": "Contrast-isolated visible glyphs with one-pixel source edge fringe; no hidden glyph reconstruction.",
      "parentId": "objective-body"
    },
    {
      "id": "phase-frame",
      "category": "ui-frame",
      "label": "Phase panel gold perimeter",
      "priority": 100,
      "shape": {
        "type": "polygon",
        "points": [
          [
            1230,
            25
          ],
          [
            1516,
            25
          ],
          [
            1520,
            31
          ],
          [
            1520,
            64
          ],
          [
            1504,
            79
          ],
          [
            1497,
            103
          ],
          [
            1336,
            103
          ],
          [
            1324,
            74
          ],
          [
            1231,
            71
          ],
          [
            1227,
            64
          ],
          [
            1227,
            33
          ]
        ]
      }
    },
    {
      "id": "phase-body",
      "category": "ui-panel",
      "label": "Phase midnight panel",
      "priority": 110,
      "shape": {
        "type": "polygon",
        "points": [
          [
            1234,
            30
          ],
          [
            1513,
            30
          ],
          [
            1515,
            63
          ],
          [
            1499,
            76
          ],
          [
            1494,
            99
          ],
          [
            1341,
            99
          ],
          [
            1328,
            70
          ],
          [
            1234,
            67
          ]
        ]
      },
      "parentId": "phase-frame"
    },
    {
      "id": "phase-party",
      "category": "text",
      "label": "PARTY",
      "priority": 150,
      "shape": {
        "type": "mask",
        "src": "masks/ui/phase-party.png",
        "bounds": [
          1249,
          38,
          69,
          23
        ]
      },
      "text": {
        "value": "PARTY",
        "confidence": 1.0,
        "fontApproximation": "Condensed serif display; original font unavailable in flattened source",
        "editableOriginal": false
      },
      "tags": [
        "source-visible-glyphs",
        "baked-antialiasing"
      ],
      "note": "Contrast-isolated visible glyphs with one-pixel source edge fringe; no hidden glyph reconstruction.",
      "parentId": "phase-body"
    },
    {
      "id": "phase-label",
      "category": "text",
      "label": "PHASE",
      "priority": 150,
      "shape": {
        "type": "mask",
        "src": "masks/ui/phase-label.png",
        "bounds": [
          1323,
          38,
          64,
          23
        ]
      },
      "text": {
        "value": "PHASE",
        "confidence": 1.0,
        "fontApproximation": "Condensed serif display; original font unavailable in flattened source",
        "editableOriginal": false
      },
      "tags": [
        "source-visible-glyphs",
        "baked-antialiasing"
      ],
      "note": "Contrast-isolated visible glyphs with one-pixel source edge fringe; no hidden glyph reconstruction.",
      "parentId": "phase-body"
    },
    {
      "id": "phase-dot",
      "category": "text",
      "label": "\u2022",
      "priority": 150,
      "shape": {
        "type": "mask",
        "src": "masks/ui/phase-dot.png",
        "bounds": [
          1396,
          40,
          11,
          16
        ]
      },
      "text": {
        "value": "\u2022",
        "confidence": 1.0,
        "fontApproximation": "Condensed serif display; original font unavailable in flattened source",
        "editableOriginal": false
      },
      "tags": [
        "source-visible-glyphs",
        "baked-antialiasing"
      ],
      "note": "Contrast-isolated visible glyphs with one-pixel source edge fringe; no hidden glyph reconstruction.",
      "parentId": "phase-body"
    },
    {
      "id": "phase-round",
      "category": "text",
      "label": "ROUND 2",
      "priority": 150,
      "shape": {
        "type": "mask",
        "src": "masks/ui/phase-round.png",
        "bounds": [
          1416,
          38,
          86,
          23
        ]
      },
      "text": {
        "value": "ROUND 2",
        "confidence": 1.0,
        "fontApproximation": "Condensed serif display; original font unavailable in flattened source",
        "editableOriginal": false
      },
      "tags": [
        "source-visible-glyphs",
        "baked-antialiasing"
      ],
      "note": "Contrast-isolated visible glyphs with one-pixel source edge fringe; no hidden glyph reconstruction.",
      "parentId": "phase-body"
    },
    {
      "id": "phase-diamond-1",
      "category": "ui-indicator",
      "label": "Phase resource diamond 1",
      "priority": 125,
      "shape": {
        "type": "polygon",
        "points": [
          [
            1378,
            64
          ],
          [
            1393,
            80
          ],
          [
            1378,
            96
          ],
          [
            1363,
            80
          ]
        ]
      },
      "parentId": "phase-body"
    },
    {
      "id": "phase-diamond-2",
      "category": "ui-indicator",
      "label": "Phase resource diamond 2",
      "priority": 125,
      "shape": {
        "type": "polygon",
        "points": [
          [
            1420,
            64
          ],
          [
            1435,
            80
          ],
          [
            1420,
            96
          ],
          [
            1405,
            80
          ]
        ]
      },
      "parentId": "phase-body"
    },
    {
      "id": "phase-diamond-3",
      "category": "ui-indicator",
      "label": "Phase resource diamond 3",
      "priority": 125,
      "shape": {
        "type": "polygon",
        "points": [
          [
            1461,
            64
          ],
          [
            1476,
            80
          ],
          [
            1461,
            96
          ],
          [
            1446,
            80
          ]
        ]
      },
      "parentId": "phase-body"
    },
    {
      "id": "party-carl-glow",
      "category": "ui-glow",
      "label": "Selected Carl portrait glow",
      "priority": 100,
      "shape": {
        "type": "rect",
        "bounds": [
          11,
          743,
          122,
          88
        ]
      }
    },
    {
      "id": "party-carl-frame",
      "category": "ui-frame",
      "label": "Carl party portrait frame",
      "priority": 110,
      "shape": {
        "type": "rect",
        "bounds": [
          18,
          750,
          108,
          77
        ]
      }
    },
    {
      "id": "party-carl-body",
      "category": "ui-panel",
      "label": "Carl portrait dark backing",
      "priority": 115,
      "shape": {
        "type": "rect",
        "bounds": [
          23,
          756,
          98,
          65
        ]
      },
      "parentId": "party-carl-frame"
    },
    {
      "id": "party-carl-portrait",
      "category": "ui-portrait",
      "label": "Carl portrait artwork",
      "priority": 120,
      "shape": {
        "type": "mask",
        "src": "masks/ui/party-carl-portrait.png",
        "bounds": [
          25,
          757,
          88,
          65
        ]
      },
      "parentId": "party-carl-frame",
      "note": "Visible portrait foreground isolated from navy backing; source black edge retained. Boundary silhouette is a source-cutout approximation: ambiguous one-pixel frame/art blends stay original RGB and may be assigned to backing."
    },
    {
      "id": "party-carl-marker",
      "category": "ui-indicator",
      "label": "Carl ready marker",
      "priority": 135,
      "shape": {
        "type": "rect",
        "bounds": [
          103,
          756,
          17,